{"$schema":"https://cdn.jsdelivr.net/gh/forge-arcana/kod-data@main/schema/crypto.schema.json","dataset":"crypto","base":"USD","unit":"usd","date":"2026-09-18","updated":"2026-09-18T15:51:20.916Z","sources":["coingecko"],"sourcesMeta":{"coingecko":{"date":"2026-09-18"}},"count":97,"prices":{"AAVE":137.98,"ADA":0.218958,"AERO":0.647685,"AKE":0.0261311,"ALGO":0.096272,"APT":0.673191,"ARB":0.209972,"ASTER":0.753891,"ATOM":1.69,"AVAX":8.09,"BCAP":106.54,"BCH":251.57,"BDX":0.075655,"BFUSD":0.999124,"BGB":2,"BNB":755.38,"BTC":80662,"BTW":0.674278,"BUIDL":1,"CAKE":2.46,"CC":0.108485,"CRO":0.059237,"DAI":1,"DASH":58.8,"DOGE":0.087224,"DOT":1.13,"ENA":0.165528,"ETC":8.09,"ETH":2576.76,"ETHFI":0.731371,"EURSAFO":1.16,"EUTBL":1.21,"FIL":0.887436,"GHO":0.99891,"GRAM":1.37,"GT":9.88,"HBAR":0.078662,"HTX":0.00000169,"HYPE":91.25,"ICP":2.84,"INJ":6.56,"JAAA":1.05,"JST":0.115243,"JUP":0.261298,"KAS":0.03641011,"KCS":7.13,"LEO":8.87,"LINK":12.14,"LIT":4.82,"LTC":55.95,"MNT":0.599225,"MORPHO":2.42,"NEAR":3.71,"NEXO":0.837088,"OKB":115.54,"ONDO":0.394638,"PAXG":4351.02,"PEPE":0.00000381,"PI":0.084098,"POL":0.100838,"PUMP":0.00430287,"PYUSD":1,"QNT":63.64,"RAIN":0.01298534,"RENDER":1.55,"RLUSD":1,"SHIB":0.00000545,"SKY":0.070265,"SOL":110.56,"STABLE":0.02525901,"SUI":0.800204,"TAO":250.49,"TRUMP":2.11,"TRX":0.339222,"UNI":8.77,"USD1":0.999471,"USDC":0.999677,"USDD":0.998514,"USDE":0.999757,"USDF":0.995829,"USDG":1,"USDGO":0.999956,"USDS":1,"USDT":0.999497,"USDY":1.14,"USTB":11.22,"USYC":1.14,"VET":0.00779705,"VVV":26.39,"WBT":82.74,"WLD":0.429469,"WLFI":0.058282,"XAUT":4357.32,"XLM":0.191052,"XMR":564.27,"XRP":1.38,"ZEC":1482.1},"assets":[{"rank":1,"symbol":"BTC","name":"Bitcoin","id":"bitcoin","price":80662,"market_cap":1619543205001,"volume_24h":39053632123,"change_24h":5.3295},{"rank":2,"symbol":"ETH","name":"Ethereum","id":"ethereum","price":2576.76,"market_cap":314348364646,"volume_24h":18693704210,"change_24h":4.47396},{"rank":3,"symbol":"USDT","name":"Tether","id":"tether","price":0.999497,"market_cap":183349179065,"volume_24h":73953093392,"change_24h":0.02626},{"rank":4,"symbol":"BNB","name":"BNB","id":"binancecoin","price":755.38,"market_cap":100552924232,"volume_24h":1466364580,"change_24h":3.92425},{"rank":5,"symbol":"XRP","name":"XRP","id":"ripple","price":1.38,"market_cap":86507547180,"volume_24h":3510941307,"change_24h":5.47414},{"rank":6,"symbol":"USDC","name":"USDC","id":"usd-coin","price":0.999677,"market_cap":73871491969,"volume_24h":19634103083,"change_24h":0.00844},{"rank":7,"symbol":"SOL","name":"Solana","id":"solana","price":110.56,"market_cap":64832889174,"volume_24h":5575679974,"change_24h":9.54792},{"rank":8,"symbol":"TRX","name":"TRON","id":"tron","price":0.339222,"market_cap":32208927096,"volume_24h":389229803,"change_24h":1.53826},{"rank":9,"symbol":"ZEC","name":"Zcash","id":"zcash","price":1482.1,"market_cap":25054547584,"volume_24h":2078412630,"change_24h":1.80515},{"rank":11,"symbol":"HYPE","name":"Hyperliquid","id":"hyperliquid","price":91.25,"market_cap":20284359735,"volume_24h":1709923314,"change_24h":10.797},{"rank":12,"symbol":"DOGE","name":"Dogecoin","id":"dogecoin","price":0.087224,"market_cap":13591560597,"volume_24h":1028518990,"change_24h":6.72276},{"rank":13,"symbol":"XMR","name":"Monero","id":"monero","price":564.27,"market_cap":10617010312,"volume_24h":172899775,"change_24h":10.58683},{"rank":14,"symbol":"WBT","name":"WhiteBIT Coin","id":"whitebit","price":82.74,"market_cap":9833986487,"volume_24h":142520421,"change_24h":4.76658},{"rank":15,"symbol":"USDS","name":"USDS","id":"usds","price":1,"market_cap":9567327215,"volume_24h":145266291,"change_24h":0.02821},{"rank":16,"symbol":"RAIN","name":"Rain","id":"rain","price":0.01298534,"market_cap":9212196099,"volume_24h":18583452,"change_24h":0.38801},{"rank":17,"symbol":"LINK","name":"Chainlink","id":"chainlink","price":12.14,"market_cap":9074953417,"volume_24h":523801957,"change_24h":6.9133},{"rank":18,"symbol":"ADA","name":"Cardano","id":"cardano","price":0.218958,"market_cap":8206158930,"volume_24h":612893443,"change_24h":8.30841},{"rank":19,"symbol":"LEO","name":"LEO Token","id":"leo-token","price":8.87,"market_cap":8158541624,"volume_24h":79285,"change_24h":-0.58492},{"rank":20,"symbol":"XLM","name":"Stellar","id":"stellar","price":0.191052,"market_cap":6654079981,"volume_24h":228423104,"change_24h":2.76154},{"rank":21,"symbol":"UNI","name":"Uniswap","id":"uniswap","price":8.77,"market_cap":5447408173,"volume_24h":2110787648,"change_24h":21.99554},{"rank":22,"symbol":"BCH","name":"Bitcoin Cash","id":"bitcoin-cash","price":251.57,"market_cap":5054488546,"volume_24h":217299428,"change_24h":8.17356},{"rank":23,"symbol":"NEAR","name":"NEAR Protocol","id":"near","price":3.71,"market_cap":4845444651,"volume_24h":2001835030,"change_24h":29.24456},{"rank":24,"symbol":"USDE","name":"Ethena USDe","id":"ethena-usde","price":0.999757,"market_cap":4811052918,"volume_24h":31581123,"change_24h":0.02328},{"rank":25,"symbol":"DAI","name":"Dai","id":"dai","price":1,"market_cap":4574459512,"volume_24h":269523469,"change_24h":0.02296},{"rank":26,"symbol":"USD1","name":"USD1","id":"usd1-wlfi","price":0.999471,"market_cap":4344495610,"volume_24h":1103989406,"change_24h":0.03593},{"rank":27,"symbol":"LTC","name":"Litecoin","id":"litecoin","price":55.95,"market_cap":4343530489,"volume_24h":304132508,"change_24h":4.95057},{"rank":28,"symbol":"CC","name":"Canton","id":"canton-network","price":0.108485,"market_cap":4294453270,"volume_24h":19356155,"change_24h":7.19768},{"rank":29,"symbol":"GRAM","name":"Gram (prev. Toncoin)","id":"the-open-network","price":1.37,"market_cap":3835798620,"volume_24h":37933177,"change_24h":1.98105},{"rank":30,"symbol":"AVAX","name":"Avalanche","id":"avalanche-2","price":8.09,"market_cap":3583432437,"volume_24h":386849991,"change_24h":6.72296},{"rank":31,"symbol":"HBAR","name":"Hedera","id":"hedera-hashgraph","price":0.078662,"market_cap":3444126791,"volume_24h":87414185,"change_24h":3.29266},{"rank":32,"symbol":"SUI","name":"Sui","id":"sui","price":0.800204,"market_cap":3274294770,"volume_24h":720289029,"change_24h":9.30731},{"rank":33,"symbol":"USDG","name":"Global Dollar","id":"global-dollar","price":1,"market_cap":3254076701,"volume_24h":1010723974,"change_24h":0.00815},{"rank":34,"symbol":"SHIB","name":"Shiba Inu","id":"shiba-inu","price":0.00000545,"market_cap":3215569185,"volume_24h":113104968,"change_24h":5.71316},{"rank":36,"symbol":"CRO","name":"Cronos","id":"crypto-com-chain","price":0.059237,"market_cap":2952602785,"volume_24h":9493222,"change_24h":1.82323},{"rank":37,"symbol":"TAO","name":"Bittensor","id":"bittensor","price":250.49,"market_cap":2839527250,"volume_24h":260835187,"change_24h":9.89551},{"rank":38,"symbol":"PYUSD","name":"PayPal USD","id":"paypal-usd","price":1,"market_cap":2774780531,"volume_24h":81685460,"change_24h":0.06588},{"rank":39,"symbol":"XAUT","name":"Tether Gold","id":"tether-gold","price":4357.32,"market_cap":2713807669,"volume_24h":193146683,"change_24h":-0.05437},{"rank":40,"symbol":"USYC","name":"Circle USYC","id":"hashnote-usyc","price":1.14,"market_cap":2508311923,"volume_24h":0,"change_24h":0.03042},{"rank":41,"symbol":"OKB","name":"OKB","id":"okb","price":115.54,"market_cap":2424048407,"volume_24h":32195514,"change_24h":2.68829},{"rank":42,"symbol":"BUIDL","name":"BlackRock USD Institutional Digital Liquidity Fund","id":"blackrock-usd-institutional-digital-liquidity-fund","price":1,"market_cap":2401998374,"volume_24h":0,"change_24h":0},{"rank":43,"symbol":"RLUSD","name":"Ripple USD","id":"ripple-usd","price":1,"market_cap":2349862886,"volume_24h":201610316,"change_24h":0.00653},{"rank":44,"symbol":"USDY","name":"Ondo US Dollar Yield","id":"ondo-us-dollar-yield","price":1.14,"market_cap":2238365380,"volume_24h":2648700,"change_24h":0.15581},{"rank":45,"symbol":"AAVE","name":"Aave","id":"aave","price":137.98,"market_cap":2127724071,"volume_24h":362617179,"change_24h":9.70191},{"rank":46,"symbol":"ASTER","name":"Aster","id":"aster-2","price":0.753891,"market_cap":2038553243,"volume_24h":111153762,"change_24h":1.26933},{"rank":47,"symbol":"PUMP","name":"Pump.fun","id":"pump-fun","price":0.00430287,"market_cap":2010906450,"volume_24h":190205722,"change_24h":8.30515},{"rank":48,"symbol":"MNT","name":"Mantle","id":"mantle","price":0.599225,"market_cap":1978095446,"volume_24h":39628787,"change_24h":5.34951},{"rank":49,"symbol":"DOT","name":"Polkadot","id":"polkadot","price":1.13,"market_cap":1932561416,"volume_24h":267481847,"change_24h":7.00242},{"rank":50,"symbol":"ONDO","name":"Ondo","id":"ondo-finance","price":0.394638,"market_cap":1921238267,"volume_24h":234471848,"change_24h":5.78795},{"rank":51,"symbol":"PAXG","name":"PAX Gold","id":"pax-gold","price":4351.02,"market_cap":1890497193,"volume_24h":173486167,"change_24h":-0.22667},{"rank":52,"symbol":"WLFI","name":"World Liberty Financial","id":"world-liberty-financial","price":0.058282,"market_cap":1850176575,"volume_24h":36555384,"change_24h":2.18772},{"rank":53,"symbol":"BTW","name":"Bitway","id":"bitway","price":0.674278,"market_cap":1821045167,"volume_24h":4982931,"change_24h":-5.93266},{"rank":54,"symbol":"MORPHO","name":"Morpho","id":"morpho","price":2.42,"market_cap":1693277076,"volume_24h":40636764,"change_24h":10.97068},{"rank":55,"symbol":"ENA","name":"Ethena","id":"ethena","price":0.165528,"market_cap":1667809845,"volume_24h":444548091,"change_24h":8.21634},{"rank":56,"symbol":"SKY","name":"Sky","id":"sky","price":0.070265,"market_cap":1647823028,"volume_24h":38459982,"change_24h":18.63665},{"rank":57,"symbol":"PEPE","name":"Pepe","id":"pepe","price":0.00000381,"market_cap":1602200413,"volume_24h":283405926,"change_24h":5.46062},{"rank":58,"symbol":"ICP","name":"Internet Computer","id":"internet-computer","price":2.84,"market_cap":1580253108,"volume_24h":56337622,"change_24h":10.04385},{"rank":59,"symbol":"WLD","name":"Worldcoin","id":"worldcoin-wld","price":0.429469,"market_cap":1544383536,"volume_24h":394857720,"change_24h":14.5